{
  "authorization": {
    "decided_at": "2026-08-12T12:00:00Z",
    "decided_by": {
      "id": "policy-router",
      "kind": "router",
      "version": "1.0.0"
    },
    "decision": "allow",
    "reason": "In scope and budget",
    "rule_ids": [
      "rul_01J00000000000000000000001"
    ],
    "scope_manifest_id": "scp_01J00000000000000000000001"
  },
  "budget_effect": {
    "token_units": 1000,
    "tool_seconds": 0,
    "wall_minutes": 10
  },
  "context_pack_id": "ctx_01J00000000000000000000001",
  "created_at": "2026-08-12T12:00:00Z",
  "deadline": "2026-08-12T13:00:00Z",
  "deduplication_key": "gate-a:hyp-1",
  "dependencies": [],
  "emitted_operation_ids": [
    "op_01J00000000000000000000001"
  ],
  "handler": {
    "id": "gate-a",
    "kind": "service",
    "version": "1.0.0"
  },
  "integrity": {
    "algorithm": "sha256",
    "canonicalization": "rfc8785",
    "content_hash": "sha256:a031195bf5b64b25051f33ce1a332c5fb72e7bdf97765239825c2205dfecdc80",
    "excluded_fields": [
      "integrity.content_hash"
    ]
  },
  "owner": {
    "id": "policy-router",
    "kind": "router",
    "version": "1.0.0"
  },
  "policy_version": "1.0.0",
  "priority": 100,
  "provenance": [
    {
      "license_or_terms": "private-test-fixture",
      "provenance_id": "prv_01J00000000000000000000001",
      "raw_hash": "sha256:bbbbbbbbbbbbbbbbbbbbbbbbbbbbbbbbbbbbbbbbbbbbbbbbbbbbbbbbbbbbbbbb",
      "retrieved_at": "2026-08-12T12:00:00Z",
      "source_uri": "https://fixtures.ayran.dev/m0",
      "source_version": "fixture-v1",
      "transformation_lineage": []
    }
  ],
  "result_ids": [
    "dav_01J00000000000000000000001"
  ],
  "router_action_id": "rta_01J00000000000000000000001",
  "run_id": "run_01J00000000000000000000001",
  "schema_version": "1.0.0",
  "status": "succeeded",
  "stop_condition": "One decisive verdict",
  "target_identity": {
    "commit": "1111111111111111111111111111111111111111",
    "scope_id": "scp_01J00000000000000000000001",
    "source_tree_hash": "sha256:dddddddddddddddddddddddddddddddddddddddddddddddddddddddddddddddd",
    "target_id": "tgt_01J00000000000000000000001"
  },
  "triggering_event_ids": [
    "evt_01J00000000000000000000001"
  ]
}
